
          /\      |‾‾| /‾‾/   /‾‾/   
     /\  /  \     |  |/  /   /  /    
    /  \/    \    |     (   /   ‾‾\  
   /          \   |  |\  \ |  (‾)  | 
  / __________ \  |__| \__\ \_____/ .io

  execution: local
     script: k6-tests/01-baseline-test.js
     output: -

  scenarios: (100.00%) 1 scenario, 10 max VUs, 5m30s max duration (incl. graceful stop):
           * default: Up to 10 looping VUs for 5m0s over 3 stages (gracefulRampDown: 30s, gracefulStop: 30s)


running (0m01.0s), 01/10 VUs, 0 complete and 0 interrupted iterations
default   [   0% ] 01/10 VUs  0m01.0s/5m00.0s

running (0m02.0s), 01/10 VUs, 0 complete and 0 interrupted iterations
default   [   1% ] 01/10 VUs  0m02.0s/5m00.0s

running (0m03.0s), 01/10 VUs, 0 complete and 0 interrupted iterations
default   [   1% ] 01/10 VUs  0m03.0s/5m00.0s

running (0m04.0s), 01/10 VUs, 0 complete and 0 interrupted iterations
default   [   1% ] 01/10 VUs  0m04.0s/5m00.0s

running (0m05.0s), 01/10 VUs, 0 complete and 0 interrupted iterations
default   [   2% ] 01/10 VUs  0m05.0s/5m00.0s

running (0m06.0s), 01/10 VUs, 0 complete and 0 interrupted iterations
default   [   2% ] 01/10 VUs  0m06.0s/5m00.0s

running (0m07.0s), 01/10 VUs, 0 complete and 0 interrupted iterations
default   [   2% ] 01/10 VUs  0m07.0s/5m00.0s

running (0m08.0s), 01/10 VUs, 0 complete and 0 interrupted iterations
default   [   3% ] 01/10 VUs  0m08.0s/5m00.0s

running (0m09.0s), 01/10 VUs, 1 complete and 0 interrupted iterations
default   [   3% ] 01/10 VUs  0m09.0s/5m00.0s

running (0m10.0s), 01/10 VUs, 1 complete and 0 interrupted iterations
default   [   3% ] 01/10 VUs  0m10.0s/5m00.0s

running (0m11.0s), 01/10 VUs, 1 complete and 0 interrupted iterations
default   [   4% ] 01/10 VUs  0m11.0s/5m00.0s

running (0m12.0s), 01/10 VUs, 1 complete and 0 interrupted iterations
default   [   4% ] 01/10 VUs  0m12.0s/5m00.0s

running (0m13.0s), 01/10 VUs, 1 complete and 0 interrupted iterations
default   [   4% ] 01/10 VUs  0m13.0s/5m00.0s

running (0m14.0s), 01/10 VUs, 1 complete and 0 interrupted iterations
default   [   5% ] 01/10 VUs  0m14.0s/5m00.0s

running (0m15.0s), 02/10 VUs, 1 complete and 0 interrupted iterations
default   [   5% ] 02/10 VUs  0m15.0s/5m00.0s

running (0m16.0s), 02/10 VUs, 1 complete and 0 interrupted iterations
default   [   5% ] 02/10 VUs  0m16.0s/5m00.0s

running (0m17.0s), 02/10 VUs, 2 complete and 0 interrupted iterations
default   [   6% ] 02/10 VUs  0m17.0s/5m00.0s

running (0m18.0s), 02/10 VUs, 2 complete and 0 interrupted iterations
default   [   6% ] 02/10 VUs  0m18.0s/5m00.0s

running (0m19.0s), 02/10 VUs, 2 complete and 0 interrupted iterations
default   [   6% ] 02/10 VUs  0m19.0s/5m00.0s

running (0m20.0s), 02/10 VUs, 2 complete and 0 interrupted iterations
default   [   7% ] 02/10 VUs  0m20.0s/5m00.0s

running (0m21.0s), 02/10 VUs, 2 complete and 0 interrupted iterations
default   [   7% ] 02/10 VUs  0m21.0s/5m00.0s

running (0m22.0s), 02/10 VUs, 2 complete and 0 interrupted iterations
default   [   7% ] 02/10 VUs  0m22.0s/5m00.0s

running (0m23.0s), 02/10 VUs, 2 complete and 0 interrupted iterations
default   [   8% ] 02/10 VUs  0m23.0s/5m00.0s

running (0m24.0s), 02/10 VUs, 3 complete and 0 interrupted iterations
default   [   8% ] 02/10 VUs  0m24.0s/5m00.0s

running (0m25.0s), 02/10 VUs, 4 complete and 0 interrupted iterations
default   [   8% ] 02/10 VUs  0m25.0s/5m00.0s

running (0m26.0s), 02/10 VUs, 4 complete and 0 interrupted iterations
default   [   9% ] 02/10 VUs  0m26.0s/5m00.0s

running (0m27.0s), 02/10 VUs, 4 complete and 0 interrupted iterations
default   [   9% ] 02/10 VUs  0m27.0s/5m00.0s

running (0m28.0s), 02/10 VUs, 4 complete and 0 interrupted iterations
default   [   9% ] 02/10 VUs  0m28.0s/5m00.0s

running (0m29.0s), 02/10 VUs, 4 complete and 0 interrupted iterations
default   [  10% ] 02/10 VUs  0m29.0s/5m00.0s

running (0m30.0s), 03/10 VUs, 4 complete and 0 interrupted iterations
default   [  10% ] 03/10 VUs  0m30.0s/5m00.0s

running (0m31.0s), 03/10 VUs, 4 complete and 0 interrupted iterations
default   [  10% ] 03/10 VUs  0m31.0s/5m00.0s

running (0m32.0s), 03/10 VUs, 5 complete and 0 interrupted iterations
default   [  11% ] 03/10 VUs  0m32.0s/5m00.0s

running (0m33.0s), 03/10 VUs, 6 complete and 0 interrupted iterations
default   [  11% ] 03/10 VUs  0m33.0s/5m00.0s

running (0m34.0s), 03/10 VUs, 6 complete and 0 interrupted iterations
default   [  11% ] 03/10 VUs  0m34.0s/5m00.0s

running (0m35.0s), 03/10 VUs, 6 complete and 0 interrupted iterations
default   [  12% ] 03/10 VUs  0m35.0s/5m00.0s

running (0m36.0s), 03/10 VUs, 6 complete and 0 interrupted iterations
default   [  12% ] 03/10 VUs  0m36.0s/5m00.0s

running (0m37.0s), 03/10 VUs, 6 complete and 0 interrupted iterations
default   [  12% ] 03/10 VUs  0m37.0s/5m00.0s

running (0m38.0s), 03/10 VUs, 6 complete and 0 interrupted iterations
default   [  13% ] 03/10 VUs  0m38.0s/5m00.0s

running (0m39.0s), 03/10 VUs, 7 complete and 0 interrupted iterations
default   [  13% ] 03/10 VUs  0m39.0s/5m00.0s

running (0m40.0s), 03/10 VUs, 8 complete and 0 interrupted iterations
default   [  13% ] 03/10 VUs  0m40.0s/5m00.0s

running (0m41.0s), 03/10 VUs, 9 complete and 0 interrupted iterations
default   [  14% ] 03/10 VUs  0m41.0s/5m00.0s

running (0m42.0s), 03/10 VUs, 9 complete and 0 interrupted iterations
default   [  14% ] 03/10 VUs  0m42.0s/5m00.0s

running (0m43.0s), 03/10 VUs, 9 complete and 0 interrupted iterations
default   [  14% ] 03/10 VUs  0m43.0s/5m00.0s

running (0m44.0s), 03/10 VUs, 9 complete and 0 interrupted iterations
default   [  15% ] 03/10 VUs  0m44.0s/5m00.0s

running (0m45.0s), 03/10 VUs, 9 complete and 0 interrupted iterations
default   [  15% ] 03/10 VUs  0m45.0s/5m00.0s

running (0m46.0s), 04/10 VUs, 10 complete and 0 interrupted iterations
default   [  15% ] 04/10 VUs  0m46.0s/5m00.0s

running (0m47.0s), 04/10 VUs, 11 complete and 0 interrupted iterations
default   [  16% ] 04/10 VUs  0m47.0s/5m00.0s

running (0m48.0s), 04/10 VUs, 12 complete and 0 interrupted iterations
default   [  16% ] 04/10 VUs  0m48.0s/5m00.0s

running (0m49.0s), 04/10 VUs, 12 complete and 0 interrupted iterations
default   [  16% ] 04/10 VUs  0m49.0s/5m00.0s

running (0m50.0s), 04/10 VUs, 12 complete and 0 interrupted iterations
default   [  17% ] 04/10 VUs  0m50.0s/5m00.0s

running (0m51.0s), 04/10 VUs, 12 complete and 0 interrupted iterations
default   [  17% ] 04/10 VUs  0m51.0s/5m00.0s

running (0m52.0s), 04/10 VUs, 12 complete and 0 interrupted iterations
default   [  17% ] 04/10 VUs  0m52.0s/5m00.0s

running (0m53.0s), 04/10 VUs, 12 complete and 0 interrupted iterations
default   [  18% ] 04/10 VUs  0m53.0s/5m00.0s

running (0m54.0s), 04/10 VUs, 14 complete and 0 interrupted iterations
default   [  18% ] 04/10 VUs  0m54.0s/5m00.0s

running (0m55.0s), 04/10 VUs, 15 complete and 0 interrupted iterations
default   [  18% ] 04/10 VUs  0m55.0s/5m00.0s

running (0m56.0s), 04/10 VUs, 16 complete and 0 interrupted iterations
default   [  19% ] 04/10 VUs  0m56.0s/5m00.0s

running (0m57.0s), 04/10 VUs, 16 complete and 0 interrupted iterations
default   [  19% ] 04/10 VUs  0m57.0s/5m00.0s

running (0m58.0s), 04/10 VUs, 16 complete and 0 interrupted iterations
default   [  19% ] 04/10 VUs  0m58.0s/5m00.0s

running (0m59.0s), 04/10 VUs, 16 complete and 0 interrupted iterations
default   [  20% ] 04/10 VUs  0m59.0s/5m00.0s

running (1m00.0s), 05/10 VUs, 16 complete and 0 interrupted iterations
default   [  20% ] 05/10 VUs  1m00.0s/5m00.0s

running (1m01.0s), 05/10 VUs, 18 complete and 0 interrupted iterations
default   [  20% ] 05/10 VUs  1m01.0s/5m00.0s

running (1m02.0s), 05/10 VUs, 18 complete and 0 interrupted iterations
default   [  21% ] 05/10 VUs  1m02.0s/5m00.0s

running (1m03.0s), 05/10 VUs, 20 complete and 0 interrupted iterations
default   [  21% ] 05/10 VUs  1m03.0s/5m00.0s

running (1m04.0s), 05/10 VUs, 20 complete and 0 interrupted iterations
default   [  21% ] 05/10 VUs  1m04.0s/5m00.0s

running (1m05.0s), 05/10 VUs, 20 complete and 0 interrupted iterations
default   [  22% ] 05/10 VUs  1m05.0s/5m00.0s

running (1m06.0s), 05/10 VUs, 20 complete and 0 interrupted iterations
default   [  22% ] 05/10 VUs  1m06.0s/5m00.0s

running (1m07.0s), 05/10 VUs, 20 complete and 0 interrupted iterations
default   [  22% ] 05/10 VUs  1m07.0s/5m00.0s

running (1m08.0s), 05/10 VUs, 20 complete and 0 interrupted iterations
default   [  23% ] 05/10 VUs  1m08.0s/5m00.0s

running (1m09.0s), 05/10 VUs, 23 complete and 0 interrupted iterations
default   [  23% ] 05/10 VUs  1m09.0s/5m00.0s

running (1m10.0s), 05/10 VUs, 24 complete and 0 interrupted iterations
default   [  23% ] 05/10 VUs  1m10.0s/5m00.0s

running (1m11.0s), 05/10 VUs, 25 complete and 0 interrupted iterations
default   [  24% ] 05/10 VUs  1m11.0s/5m00.0s

running (1m12.0s), 05/10 VUs, 25 complete and 0 interrupted iterations
default   [  24% ] 05/10 VUs  1m12.0s/5m00.0s

running (1m13.0s), 05/10 VUs, 25 complete and 0 interrupted iterations
default   [  24% ] 05/10 VUs  1m13.0s/5m00.0s

running (1m14.0s), 05/10 VUs, 25 complete and 0 interrupted iterations
default   [  25% ] 05/10 VUs  1m14.0s/5m00.0s

running (1m15.0s), 05/10 VUs, 25 complete and 0 interrupted iterations
default   [  25% ] 05/10 VUs  1m15.0s/5m00.0s

running (1m16.0s), 05/10 VUs, 25 complete and 0 interrupted iterations
default   [  25% ] 05/10 VUs  1m16.0s/5m00.0s

running (1m17.0s), 05/10 VUs, 28 complete and 0 interrupted iterations
default   [  26% ] 05/10 VUs  1m17.0s/5m00.0s

running (1m18.0s), 05/10 VUs, 29 complete and 0 interrupted iterations
default   [  26% ] 05/10 VUs  1m18.0s/5m00.0s

running (1m19.0s), 05/10 VUs, 30 complete and 0 interrupted iterations
default   [  26% ] 05/10 VUs  1m19.0s/5m00.0s

running (1m20.0s), 05/10 VUs, 30 complete and 0 interrupted iterations
default   [  27% ] 05/10 VUs  1m20.0s/5m00.0s

running (1m21.0s), 05/10 VUs, 30 complete and 0 interrupted iterations
default   [  27% ] 05/10 VUs  1m21.0s/5m00.0s

running (1m22.0s), 05/10 VUs, 30 complete and 0 interrupted iterations
default   [  27% ] 05/10 VUs  1m22.0s/5m00.0s

running (1m23.0s), 05/10 VUs, 30 complete and 0 interrupted iterations
default   [  28% ] 05/10 VUs  1m23.0s/5m00.0s

running (1m24.0s), 05/10 VUs, 32 complete and 0 interrupted iterations
default   [  28% ] 05/10 VUs  1m24.0s/5m00.0s

running (1m25.0s), 05/10 VUs, 33 complete and 0 interrupted iterations
default   [  28% ] 05/10 VUs  1m25.0s/5m00.0s

running (1m26.0s), 05/10 VUs, 34 complete and 0 interrupted iterations
default   [  29% ] 05/10 VUs  1m26.0s/5m00.0s

running (1m27.0s), 05/10 VUs, 35 complete and 0 interrupted iterations
default   [  29% ] 05/10 VUs  1m27.0s/5m00.0s

running (1m28.0s), 05/10 VUs, 35 complete and 0 interrupted iterations
default   [  29% ] 05/10 VUs  1m28.0s/5m00.0s

running (1m29.0s), 05/10 VUs, 35 complete and 0 interrupted iterations
default   [  30% ] 05/10 VUs  1m29.0s/5m00.0s

running (1m30.0s), 05/10 VUs, 35 complete and 0 interrupted iterations
default   [  30% ] 05/10 VUs  1m30.0s/5m00.0s

running (1m31.0s), 05/10 VUs, 35 complete and 0 interrupted iterations
default   [  30% ] 05/10 VUs  1m31.0s/5m00.0s

running (1m32.0s), 05/10 VUs, 37 complete and 0 interrupted iterations
default   [  31% ] 05/10 VUs  1m32.0s/5m00.0s

running (1m33.0s), 05/10 VUs, 39 complete and 0 interrupted iterations
default   [  31% ] 05/10 VUs  1m33.0s/5m00.0s

running (1m34.0s), 05/10 VUs, 40 complete and 0 interrupted iterations
default   [  31% ] 05/10 VUs  1m34.0s/5m00.0s

running (1m35.0s), 05/10 VUs, 40 complete and 0 interrupted iterations
default   [  32% ] 05/10 VUs  1m35.0s/5m00.0s

running (1m36.0s), 05/10 VUs, 40 complete and 0 interrupted iterations
default   [  32% ] 05/10 VUs  1m36.0s/5m00.0s

running (1m37.0s), 06/10 VUs, 40 complete and 0 interrupted iterations
default   [  32% ] 06/10 VUs  1m37.0s/5m00.0s

running (1m38.0s), 06/10 VUs, 40 complete and 0 interrupted iterations
default   [  33% ] 06/10 VUs  1m38.0s/5m00.0s

running (1m39.0s), 06/10 VUs, 40 complete and 0 interrupted iterations
default   [  33% ] 06/10 VUs  1m39.0s/5m00.0s

running (1m40.0s), 06/10 VUs, 43 complete and 0 interrupted iterations
default   [  33% ] 06/10 VUs  1m40.0s/5m00.0s

running (1m41.0s), 06/10 VUs, 44 complete and 0 interrupted iterations
default   [  34% ] 06/10 VUs  1m41.0s/5m00.0s

running (1m42.0s), 06/10 VUs, 45 complete and 0 interrupted iterations
default   [  34% ] 06/10 VUs  1m42.0s/5m00.0s

running (1m43.0s), 06/10 VUs, 45 complete and 0 interrupted iterations
default   [  34% ] 06/10 VUs  1m43.0s/5m00.0s

running (1m44.0s), 06/10 VUs, 45 complete and 0 interrupted iterations
default   [  35% ] 06/10 VUs  1m44.0s/5m00.0s

running (1m45.0s), 06/10 VUs, 45 complete and 0 interrupted iterations
default   [  35% ] 06/10 VUs  1m45.0s/5m00.0s

running (1m46.0s), 06/10 VUs, 46 complete and 0 interrupted iterations
default   [  35% ] 06/10 VUs  1m46.0s/5m00.0s

running (1m47.0s), 06/10 VUs, 46 complete and 0 interrupted iterations
default   [  36% ] 06/10 VUs  1m47.0s/5m00.0s

running (1m48.0s), 06/10 VUs, 50 complete and 0 interrupted iterations
default   [  36% ] 06/10 VUs  1m48.0s/5m00.0s

running (1m49.0s), 06/10 VUs, 50 complete and 0 interrupted iterations
default   [  36% ] 06/10 VUs  1m49.0s/5m00.0s

running (1m50.0s), 06/10 VUs, 51 complete and 0 interrupted iterations
default   [  37% ] 06/10 VUs  1m50.0s/5m00.0s

running (1m51.0s), 06/10 VUs, 51 complete and 0 interrupted iterations
default   [  37% ] 06/10 VUs  1m51.0s/5m00.0s

running (1m52.0s), 06/10 VUs, 51 complete and 0 interrupted iterations
default   [  37% ] 06/10 VUs  1m52.0s/5m00.0s

running (1m53.0s), 06/10 VUs, 51 complete and 0 interrupted iterations
default   [  38% ] 06/10 VUs  1m53.0s/5m00.0s

running (1m54.0s), 06/10 VUs, 52 complete and 0 interrupted iterations
default   [  38% ] 06/10 VUs  1m54.0s/5m00.0s

running (1m55.0s), 06/10 VUs, 52 complete and 0 interrupted iterations
default   [  38% ] 06/10 VUs  1m55.0s/5m00.0s

running (1m56.0s), 06/10 VUs, 56 complete and 0 interrupted iterations
default   [  39% ] 06/10 VUs  1m56.0s/5m00.0s

running (1m57.0s), 06/10 VUs, 57 complete and 0 interrupted iterations
default   [  39% ] 06/10 VUs  1m57.0s/5m00.0s

running (1m58.0s), 06/10 VUs, 57 complete and 0 interrupted iterations
default   [  39% ] 06/10 VUs  1m58.0s/5m00.0s

running (1m59.0s), 06/10 VUs, 57 complete and 0 interrupted iterations
default   [  40% ] 06/10 VUs  1m59.0s/5m00.0s

running (2m00.0s), 06/10 VUs, 57 complete and 0 interrupted iterations
default   [  40% ] 06/10 VUs  2m00.0s/5m00.0s

running (2m01.0s), 06/10 VUs, 58 complete and 0 interrupted iterations
default   [  40% ] 06/10 VUs  2m01.0s/5m00.0s

running (2m02.0s), 06/10 VUs, 58 complete and 0 interrupted iterations
default   [  41% ] 06/10 VUs  2m02.0s/5m00.0s

running (2m03.0s), 06/10 VUs, 61 complete and 0 interrupted iterations
default   [  41% ] 06/10 VUs  2m03.0s/5m00.0s

running (2m04.0s), 06/10 VUs, 62 complete and 0 interrupted iterations
default   [  41% ] 06/10 VUs  2m04.0s/5m00.0s

running (2m05.0s), 06/10 VUs, 63 complete and 0 interrupted iterations
default   [  42% ] 06/10 VUs  2m05.0s/5m00.0s

running (2m06.0s), 06/10 VUs, 63 complete and 0 interrupted iterations
default   [  42% ] 06/10 VUs  2m06.0s/5m00.0s

running (2m07.0s), 06/10 VUs, 63 complete and 0 interrupted iterations
default   [  42% ] 06/10 VUs  2m07.0s/5m00.0s

running (2m08.0s), 06/10 VUs, 63 complete and 0 interrupted iterations
default   [  43% ] 06/10 VUs  2m08.0s/5m00.0s

running (2m09.0s), 06/10 VUs, 64 complete and 0 interrupted iterations
default   [  43% ] 06/10 VUs  2m09.0s/5m00.0s

running (2m10.0s), 06/10 VUs, 64 complete and 0 interrupted iterations
default   [  43% ] 06/10 VUs  2m10.0s/5m00.0s

running (2m11.0s), 06/10 VUs, 68 complete and 0 interrupted iterations
default   [  44% ] 06/10 VUs  2m11.0s/5m00.0s

running (2m12.0s), 06/10 VUs, 68 complete and 0 interrupted iterations
default   [  44% ] 07/10 VUs  2m12.0s/5m00.0s

running (2m13.0s), 07/10 VUs, 69 complete and 0 interrupted iterations
default   [  44% ] 07/10 VUs  2m13.0s/5m00.0s

running (2m14.0s), 07/10 VUs, 69 complete and 0 interrupted iterations
default   [  45% ] 07/10 VUs  2m14.0s/5m00.0s

running (2m15.0s), 07/10 VUs, 69 complete and 0 interrupted iterations
default   [  45% ] 07/10 VUs  2m15.0s/5m00.0s

running (2m16.0s), 07/10 VUs, 70 complete and 0 interrupted iterations
default   [  45% ] 07/10 VUs  2m16.0s/5m00.0s

running (2m17.0s), 07/10 VUs, 70 complete and 0 interrupted iterations
default   [  46% ] 07/10 VUs  2m17.0s/5m00.0s

running (2m18.0s), 07/10 VUs, 70 complete and 0 interrupted iterations
default   [  46% ] 07/10 VUs  2m18.0s/5m00.0s

running (2m19.0s), 07/10 VUs, 74 complete and 0 interrupted iterations
default   [  46% ] 07/10 VUs  2m19.0s/5m00.0s

running (2m20.0s), 07/10 VUs, 75 complete and 0 interrupted iterations
default   [  47% ] 07/10 VUs  2m20.0s/5m00.0s

running (2m21.0s), 07/10 VUs, 76 complete and 0 interrupted iterations
default   [  47% ] 07/10 VUs  2m21.0s/5m00.0s

running (2m22.0s), 07/10 VUs, 76 complete and 0 interrupted iterations
default   [  47% ] 07/10 VUs  2m22.0s/5m00.0s

running (2m23.0s), 07/10 VUs, 76 complete and 0 interrupted iterations
default   [  48% ] 07/10 VUs  2m23.0s/5m00.0s

running (2m24.0s), 07/10 VUs, 77 complete and 0 interrupted iterations
default   [  48% ] 07/10 VUs  2m24.0s/5m00.0s

running (2m25.0s), 07/10 VUs, 77 complete and 0 interrupted iterations
default   [  48% ] 07/10 VUs  2m25.0s/5m00.0s

running (2m26.0s), 07/10 VUs, 81 complete and 0 interrupted iterations
default   [  49% ] 07/10 VUs  2m26.0s/5m00.0s

running (2m27.0s), 07/10 VUs, 81 complete and 0 interrupted iterations
default   [  49% ] 07/10 VUs  2m27.0s/5m00.0s

running (2m28.0s), 07/10 VUs, 83 complete and 0 interrupted iterations
default   [  49% ] 07/10 VUs  2m28.0s/5m00.0s

running (2m29.0s), 07/10 VUs, 83 complete and 0 interrupted iterations
default   [  50% ] 07/10 VUs  2m29.0s/5m00.0s

running (2m30.0s), 07/10 VUs, 83 complete and 0 interrupted iterations
default   [  50% ] 07/10 VUs  2m30.0s/5m00.0s

running (2m31.0s), 07/10 VUs, 84 complete and 0 interrupted iterations
default   [  50% ] 07/10 VUs  2m31.0s/5m00.0s

running (2m32.0s), 07/10 VUs, 84 complete and 0 interrupted iterations
default   [  51% ] 07/10 VUs  2m32.0s/5m00.0s

running (2m33.0s), 07/10 VUs, 84 complete and 0 interrupted iterations
default   [  51% ] 07/10 VUs  2m33.0s/5m00.0s

running (2m34.0s), 07/10 VUs, 88 complete and 0 interrupted iterations
default   [  51% ] 07/10 VUs  2m34.0s/5m00.0s

running (2m35.0s), 07/10 VUs, 89 complete and 0 interrupted iterations
default   [  52% ] 07/10 VUs  2m35.0s/5m00.0s

running (2m36.0s), 07/10 VUs, 90 complete and 0 interrupted iterations
default   [  52% ] 07/10 VUs  2m36.0s/5m00.0s

running (2m37.0s), 07/10 VUs, 90 complete and 0 interrupted iterations
default   [  52% ] 07/10 VUs  2m37.0s/5m00.0s

running (2m38.0s), 07/10 VUs, 90 complete and 0 interrupted iterations
default   [  53% ] 07/10 VUs  2m38.0s/5m00.0s

running (2m39.0s), 07/10 VUs, 91 complete and 0 interrupted iterations
default   [  53% ] 07/10 VUs  2m39.0s/5m00.0s

running (2m40.0s), 07/10 VUs, 91 complete and 0 interrupted iterations
default   [  53% ] 07/10 VUs  2m40.0s/5m00.0s

running (2m41.0s), 07/10 VUs, 94 complete and 0 interrupted iterations
default   [  54% ] 07/10 VUs  2m41.0s/5m00.0s

running (2m42.0s), 07/10 VUs, 95 complete and 0 interrupted iterations
default   [  54% ] 07/10 VUs  2m42.0s/5m00.0s

running (2m43.0s), 07/10 VUs, 97 complete and 0 interrupted iterations
default   [  54% ] 07/10 VUs  2m43.0s/5m00.0s

running (2m44.0s), 07/10 VUs, 97 complete and 0 interrupted iterations
default   [  55% ] 07/10 VUs  2m44.0s/5m00.0s

running (2m45.0s), 07/10 VUs, 97 complete and 0 interrupted iterations
default   [  55% ] 07/10 VUs  2m45.0s/5m00.0s

running (2m46.0s), 07/10 VUs, 98 complete and 0 interrupted iterations
default   [  55% ] 07/10 VUs  2m46.0s/5m00.0s

running (2m47.0s), 07/10 VUs, 98 complete and 0 interrupted iterations
default   [  56% ] 07/10 VUs  2m47.0s/5m00.0s

running (2m48.0s), 08/10 VUs, 98 complete and 0 interrupted iterations
default   [  56% ] 08/10 VUs  2m48.0s/5m00.0s

running (2m49.0s), 08/10 VUs, 102 complete and 0 interrupted iterations
default   [  56% ] 08/10 VUs  2m49.0s/5m00.0s

running (2m50.0s), 08/10 VUs, 103 complete and 0 interrupted iterations
default   [  57% ] 08/10 VUs  2m50.0s/5m00.0s

running (2m51.0s), 08/10 VUs, 104 complete and 0 interrupted iterations
default   [  57% ] 08/10 VUs  2m51.0s/5m00.0s

running (2m52.0s), 08/10 VUs, 104 complete and 0 interrupted iterations
default   [  57% ] 08/10 VUs  2m52.0s/5m00.0s

running (2m53.0s), 08/10 VUs, 104 complete and 0 interrupted iterations
default   [  58% ] 08/10 VUs  2m53.0s/5m00.0s

running (2m54.0s), 08/10 VUs, 105 complete and 0 interrupted iterations
default   [  58% ] 08/10 VUs  2m54.0s/5m00.0s

running (2m55.0s), 08/10 VUs, 105 complete and 0 interrupted iterations
default   [  58% ] 08/10 VUs  2m55.0s/5m00.0s

running (2m56.0s), 08/10 VUs, 109 complete and 0 interrupted iterations
default   [  59% ] 08/10 VUs  2m56.0s/5m00.0s

running (2m57.0s), 08/10 VUs, 110 complete and 0 interrupted iterations
default   [  59% ] 08/10 VUs  2m57.0s/5m00.0s

running (2m58.0s), 08/10 VUs, 112 complete and 0 interrupted iterations
default   [  59% ] 08/10 VUs  2m58.0s/5m00.0s

running (2m59.0s), 08/10 VUs, 112 complete and 0 interrupted iterations
default   [  60% ] 08/10 VUs  2m59.0s/5m00.0s

running (3m00.0s), 08/10 VUs, 112 complete and 0 interrupted iterations
default   [  60% ] 08/10 VUs  3m00.0s/5m00.0s

running (3m01.0s), 08/10 VUs, 112 complete and 0 interrupted iterations
default   [  60% ] 08/10 VUs  3m01.0s/5m00.0s

running (3m02.0s), 08/10 VUs, 113 complete and 0 interrupted iterations
default   [  61% ] 08/10 VUs  3m02.0s/5m00.0s

running (3m03.0s), 08/10 VUs, 113 complete and 0 interrupted iterations
default   [  61% ] 08/10 VUs  3m03.0s/5m00.0s

running (3m04.0s), 08/10 VUs, 118 complete and 0 interrupted iterations
default   [  61% ] 08/10 VUs  3m04.0s/5m00.0s

running (3m05.0s), 08/10 VUs, 119 complete and 0 interrupted iterations
default   [  62% ] 08/10 VUs  3m05.0s/5m00.0s

running (3m06.0s), 08/10 VUs, 120 complete and 0 interrupted iterations
default   [  62% ] 08/10 VUs  3m06.0s/5m00.0s

running (3m07.0s), 08/10 VUs, 120 complete and 0 interrupted iterations
default   [  62% ] 08/10 VUs  3m07.0s/5m00.0s

running (3m08.0s), 08/10 VUs, 120 complete and 0 interrupted iterations
default   [  63% ] 08/10 VUs  3m08.0s/5m00.0s

running (3m09.0s), 08/10 VUs, 121 complete and 0 interrupted iterations
default   [  63% ] 08/10 VUs  3m09.0s/5m00.0s

running (3m10.0s), 08/10 VUs, 121 complete and 0 interrupted iterations
default   [  63% ] 08/10 VUs  3m10.0s/5m00.0s

running (3m11.0s), 08/10 VUs, 124 complete and 0 interrupted iterations
default   [  64% ] 08/10 VUs  3m11.0s/5m00.0s

running (3m12.0s), 08/10 VUs, 126 complete and 0 interrupted iterations
default   [  64% ] 08/10 VUs  3m12.0s/5m00.0s

running (3m13.0s), 08/10 VUs, 128 complete and 0 interrupted iterations
default   [  64% ] 08/10 VUs  3m13.0s/5m00.0s

running (3m14.0s), 08/10 VUs, 128 complete and 0 interrupted iterations
default   [  65% ] 08/10 VUs  3m14.0s/5m00.0s

running (3m15.0s), 08/10 VUs, 128 complete and 0 interrupted iterations
default   [  65% ] 08/10 VUs  3m15.0s/5m00.0s

running (3m16.0s), 08/10 VUs, 128 complete and 0 interrupted iterations
default   [  65% ] 08/10 VUs  3m16.0s/5m00.0s

running (3m17.0s), 08/10 VUs, 129 complete and 0 interrupted iterations
default   [  66% ] 08/10 VUs  3m17.0s/5m00.0s

running (3m18.0s), 08/10 VUs, 129 complete and 0 interrupted iterations
default   [  66% ] 08/10 VUs  3m18.0s/5m00.0s

running (3m19.0s), 08/10 VUs, 133 complete and 0 interrupted iterations
default   [  66% ] 08/10 VUs  3m19.0s/5m00.0s

running (3m20.0s), 08/10 VUs, 135 complete and 0 interrupted iterations
default   [  67% ] 08/10 VUs  3m20.0s/5m00.0s

running (3m21.0s), 08/10 VUs, 136 complete and 0 interrupted iterations
default   [  67% ] 08/10 VUs  3m21.0s/5m00.0s

running (3m22.0s), 08/10 VUs, 136 complete and 0 interrupted iterations
default   [  67% ] 08/10 VUs  3m22.0s/5m00.0s

running (3m23.0s), 08/10 VUs, 136 complete and 0 interrupted iterations
default   [  68% ] 08/10 VUs  3m23.0s/5m00.0s

running (3m24.0s), 08/10 VUs, 137 complete and 0 interrupted iterations
default   [  68% ] 08/10 VUs  3m24.0s/5m00.0s

running (3m25.0s), 09/10 VUs, 137 complete and 0 interrupted iterations
default   [  68% ] 09/10 VUs  3m25.0s/5m00.0s

running (3m26.0s), 09/10 VUs, 137 complete and 0 interrupted iterations
default   [  69% ] 09/10 VUs  3m26.0s/5m00.0s

running (3m27.0s), 09/10 VUs, 142 complete and 0 interrupted iterations
default   [  69% ] 09/10 VUs  3m27.0s/5m00.0s

running (3m28.0s), 09/10 VUs, 143 complete and 0 interrupted iterations
default   [  69% ] 09/10 VUs  3m28.0s/5m00.0s

running (3m29.0s), 09/10 VUs, 144 complete and 0 interrupted iterations
default   [  70% ] 09/10 VUs  3m29.0s/5m00.0s

running (3m30.0s), 09/10 VUs, 144 complete and 0 interrupted iterations
default   [  70% ] 09/10 VUs  3m30.0s/5m00.0s

running (3m31.0s), 09/10 VUs, 144 complete and 0 interrupted iterations
default   [  70% ] 09/10 VUs  3m31.0s/5m00.0s

running (3m32.0s), 09/10 VUs, 146 complete and 0 interrupted iterations
default   [  71% ] 09/10 VUs  3m32.0s/5m00.0s

running (3m33.0s), 09/10 VUs, 146 complete and 0 interrupted iterations
default   [  71% ] 09/10 VUs  3m33.0s/5m00.0s

running (3m34.0s), 09/10 VUs, 151 complete and 0 interrupted iterations
default   [  71% ] 09/10 VUs  3m34.0s/5m00.0s

running (3m35.0s), 09/10 VUs, 152 complete and 0 interrupted iterations
default   [  72% ] 09/10 VUs  3m35.0s/5m00.0s

running (3m36.0s), 09/10 VUs, 153 complete and 0 interrupted iterations
default   [  72% ] 09/10 VUs  3m36.0s/5m00.0s

running (3m37.0s), 09/10 VUs, 153 complete and 0 interrupted iterations
default   [  72% ] 09/10 VUs  3m37.0s/5m00.0s

running (3m38.0s), 09/10 VUs, 153 complete and 0 interrupted iterations
default   [  73% ] 09/10 VUs  3m38.0s/5m00.0s

running (3m39.0s), 09/10 VUs, 154 complete and 0 interrupted iterations
default   [  73% ] 09/10 VUs  3m39.0s/5m00.0s

running (3m40.0s), 09/10 VUs, 155 complete and 0 interrupted iterations
default   [  73% ] 09/10 VUs  3m40.0s/5m00.0s

running (3m41.0s), 09/10 VUs, 155 complete and 0 interrupted iterations
default   [  74% ] 09/10 VUs  3m41.0s/5m00.0s

running (3m42.0s), 09/10 VUs, 161 complete and 0 interrupted iterations
default   [  74% ] 09/10 VUs  3m42.0s/5m00.0s

running (3m43.0s), 09/10 VUs, 161 complete and 0 interrupted iterations
default   [  74% ] 09/10 VUs  3m43.0s/5m00.0s

running (3m44.0s), 09/10 VUs, 162 complete and 0 interrupted iterations
default   [  75% ] 09/10 VUs  3m44.0s/5m00.0s

running (3m45.0s), 09/10 VUs, 162 complete and 0 interrupted iterations
default   [  75% ] 09/10 VUs  3m45.0s/5m00.0s

running (3m46.0s), 09/10 VUs, 162 complete and 0 interrupted iterations
default   [  75% ] 09/10 VUs  3m46.0s/5m00.0s

running (3m47.0s), 09/10 VUs, 164 complete and 0 interrupted iterations
default   [  76% ] 09/10 VUs  3m47.0s/5m00.0s

running (3m48.0s), 09/10 VUs, 164 complete and 0 interrupted iterations
default   [  76% ] 09/10 VUs  3m48.0s/5m00.0s

running (3m49.0s), 09/10 VUs, 168 complete and 0 interrupted iterations
default   [  76% ] 09/10 VUs  3m49.0s/5m00.0s

running (3m50.0s), 09/10 VUs, 170 complete and 0 interrupted iterations
default   [  77% ] 09/10 VUs  3m50.0s/5m00.0s

running (3m51.0s), 09/10 VUs, 171 complete and 0 interrupted iterations
default   [  77% ] 09/10 VUs  3m51.0s/5m00.0s

running (3m52.0s), 09/10 VUs, 171 complete and 0 interrupted iterations
default   [  77% ] 09/10 VUs  3m52.0s/5m00.0s

running (3m53.0s), 09/10 VUs, 171 complete and 0 interrupted iterations
default   [  78% ] 09/10 VUs  3m53.0s/5m00.0s

running (3m54.0s), 09/10 VUs, 172 complete and 0 interrupted iterations
default   [  78% ] 09/10 VUs  3m54.0s/5m00.0s

running (3m55.0s), 09/10 VUs, 173 complete and 0 interrupted iterations
default   [  78% ] 09/10 VUs  3m55.0s/5m00.0s

running (3m56.0s), 09/10 VUs, 173 complete and 0 interrupted iterations
default   [  79% ] 09/10 VUs  3m56.0s/5m00.0s

running (3m57.0s), 09/10 VUs, 179 complete and 0 interrupted iterations
default   [  79% ] 09/10 VUs  3m57.0s/5m00.0s

running (3m58.0s), 09/10 VUs, 179 complete and 0 interrupted iterations
default   [  79% ] 09/10 VUs  3m58.0s/5m00.0s

running (3m59.0s), 09/10 VUs, 180 complete and 0 interrupted iterations
default   [  80% ] 09/10 VUs  3m59.0s/5m00.0s

running (4m00.0s), 10/10 VUs, 180 complete and 0 interrupted iterations
default   [  80% ] 10/10 VUs  4m00.0s/5m00.0s

running (4m01.0s), 10/10 VUs, 180 complete and 0 interrupted iterations
default   [  80% ] 10/10 VUs  4m01.0s/5m00.0s

running (4m02.0s), 10/10 VUs, 182 complete and 0 interrupted iterations
default   [  81% ] 10/10 VUs  4m02.0s/5m00.0s

running (4m03.0s), 10/10 VUs, 182 complete and 0 interrupted iterations
default   [  81% ] 10/10 VUs  4m03.0s/5m00.0s

running (4m04.0s), 10/10 VUs, 186 complete and 0 interrupted iterations
default   [  81% ] 10/10 VUs  4m04.0s/5m00.0s

running (4m05.0s), 10/10 VUs, 188 complete and 0 interrupted iterations
default   [  82% ] 10/10 VUs  4m05.0s/5m00.0s

running (4m06.0s), 10/10 VUs, 189 complete and 0 interrupted iterations
default   [  82% ] 10/10 VUs  4m06.0s/5m00.0s

running (4m07.0s), 10/10 VUs, 189 complete and 0 interrupted iterations
default   [  82% ] 10/10 VUs  4m07.0s/5m00.0s

running (4m08.0s), 10/10 VUs, 189 complete and 0 interrupted iterations
default   [  83% ] 10/10 VUs  4m08.0s/5m00.0s

running (4m09.0s), 09/10 VUs, 191 complete and 0 interrupted iterations
default   [  83% ] 09/10 VUs  4m09.0s/5m00.0s

running (4m10.0s), 09/10 VUs, 192 complete and 0 interrupted iterations
default   [  83% ] 09/10 VUs  4m10.0s/5m00.0s

running (4m11.0s), 09/10 VUs, 192 complete and 0 interrupted iterations
default   [  84% ] 09/10 VUs  4m11.0s/5m00.0s

running (4m12.0s), 09/10 VUs, 198 complete and 0 interrupted iterations
default   [  84% ] 09/10 VUs  4m12.0s/5m00.0s

running (4m13.0s), 09/10 VUs, 198 complete and 0 interrupted iterations
default   [  84% ] 09/10 VUs  4m13.0s/5m00.0s

running (4m14.0s), 09/10 VUs, 199 complete and 0 interrupted iterations
default   [  85% ] 09/10 VUs  4m14.0s/5m00.0s

running (4m15.0s), 09/10 VUs, 199 complete and 0 interrupted iterations
default   [  85% ] 09/10 VUs  4m15.0s/5m00.0s

running (4m16.0s), 09/10 VUs, 199 complete and 0 interrupted iterations
default   [  85% ] 09/10 VUs  4m16.0s/5m00.0s

running (4m17.0s), 08/10 VUs, 201 complete and 0 interrupted iterations
default   [  86% ] 08/10 VUs  4m17.0s/5m00.0s

running (4m18.0s), 08/10 VUs, 201 complete and 0 interrupted iterations
default   [  86% ] 08/10 VUs  4m18.0s/5m00.0s

running (4m19.0s), 07/10 VUs, 206 complete and 0 interrupted iterations
default   [  86% ] 07/10 VUs  4m19.0s/5m00.0s

running (4m20.0s), 07/10 VUs, 207 complete and 0 interrupted iterations
default   [  87% ] 07/10 VUs  4m20.0s/5m00.0s

running (4m21.0s), 07/10 VUs, 208 complete and 0 interrupted iterations
default   [  87% ] 07/10 VUs  4m21.0s/5m00.0s

running (4m22.0s), 07/10 VUs, 208 complete and 0 interrupted iterations
default   [  87% ] 07/10 VUs  4m22.0s/5m00.0s

running (4m23.0s), 07/10 VUs, 208 complete and 0 interrupted iterations
default   [  88% ] 07/10 VUs  4m23.0s/5m00.0s

running (4m24.0s), 07/10 VUs, 209 complete and 0 interrupted iterations
default   [  88% ] 07/10 VUs  4m24.0s/5m00.0s

running (4m25.0s), 07/10 VUs, 209 complete and 0 interrupted iterations
default   [  88% ] 07/10 VUs  4m25.0s/5m00.0s

running (4m26.0s), 07/10 VUs, 210 complete and 0 interrupted iterations
default   [  89% ] 07/10 VUs  4m26.0s/5m00.0s

running (4m27.0s), 07/10 VUs, 214 complete and 0 interrupted iterations
default   [  89% ] 07/10 VUs  4m27.0s/5m00.0s

running (4m28.0s), 07/10 VUs, 214 complete and 0 interrupted iterations
default   [  89% ] 07/10 VUs  4m28.0s/5m00.0s

running (4m29.0s), 06/10 VUs, 215 complete and 0 interrupted iterations
default   [  90% ] 06/10 VUs  4m29.0s/5m00.0s

running (4m30.0s), 06/10 VUs, 215 complete and 0 interrupted iterations
default   [  90% ] 06/10 VUs  4m30.0s/5m00.0s

running (4m31.0s), 06/10 VUs, 215 complete and 0 interrupted iterations
default   [  90% ] 06/10 VUs  4m31.0s/5m00.0s

running (4m32.0s), 05/10 VUs, 216 complete and 0 interrupted iterations
default   [  91% ] 05/10 VUs  4m32.0s/5m00.0s

running (4m33.0s), 05/10 VUs, 216 complete and 0 interrupted iterations
default   [  91% ] 05/10 VUs  4m33.0s/5m00.0s

running (4m34.0s), 05/10 VUs, 220 complete and 0 interrupted iterations
default   [  91% ] 05/10 VUs  4m34.0s/5m00.0s

running (4m35.0s), 05/10 VUs, 221 complete and 0 interrupted iterations
default   [  92% ] 05/10 VUs  4m35.0s/5m00.0s

running (4m36.0s), 05/10 VUs, 221 complete and 0 interrupted iterations
default   [  92% ] 05/10 VUs  4m36.0s/5m00.0s

running (4m37.0s), 05/10 VUs, 221 complete and 0 interrupted iterations
default   [  92% ] 05/10 VUs  4m37.0s/5m00.0s

running (4m38.0s), 05/10 VUs, 221 complete and 0 interrupted iterations
default   [  93% ] 05/10 VUs  4m38.0s/5m00.0s

running (4m39.0s), 05/10 VUs, 221 complete and 0 interrupted iterations
default   [  93% ] 05/10 VUs  4m39.0s/5m00.0s

running (4m40.0s), 05/10 VUs, 221 complete and 0 interrupted iterations
default   [  93% ] 05/10 VUs  4m40.0s/5m00.0s

running (4m41.0s), 04/10 VUs, 224 complete and 0 interrupted iterations
default   [  94% ] 04/10 VUs  4m41.0s/5m00.0s

running (4m42.0s), 04/10 VUs, 226 complete and 0 interrupted iterations
default   [  94% ] 04/10 VUs  4m42.0s/5m00.0s

running (4m43.0s), 04/10 VUs, 226 complete and 0 interrupted iterations
default   [  94% ] 04/10 VUs  4m43.0s/5m00.0s

running (4m44.0s), 04/10 VUs, 226 complete and 0 interrupted iterations
default   [  95% ] 04/10 VUs  4m44.0s/5m00.0s

running (4m45.0s), 04/10 VUs, 226 complete and 0 interrupted iterations
default   [  95% ] 04/10 VUs  4m45.0s/5m00.0s

running (4m46.0s), 04/10 VUs, 226 complete and 0 interrupted iterations
default   [  95% ] 04/10 VUs  4m46.0s/5m00.0s

running (4m47.0s), 04/10 VUs, 226 complete and 0 interrupted iterations
default   [  96% ] 04/10 VUs  4m47.0s/5m00.0s

running (4m48.0s), 04/10 VUs, 226 complete and 0 interrupted iterations
default   [  96% ] 04/10 VUs  4m48.0s/5m00.0s

running (4m49.0s), 02/10 VUs, 229 complete and 0 interrupted iterations
default   [  96% ] 02/10 VUs  4m49.0s/5m00.0s

running (4m50.0s), 02/10 VUs, 230 complete and 0 interrupted iterations
default   [  97% ] 02/10 VUs  4m50.0s/5m00.0s

running (4m51.0s), 02/10 VUs, 230 complete and 0 interrupted iterations
default   [  97% ] 02/10 VUs  4m51.0s/5m00.0s

running (4m52.0s), 02/10 VUs, 230 complete and 0 interrupted iterations
default   [  97% ] 02/10 VUs  4m52.0s/5m00.0s

running (4m53.0s), 02/10 VUs, 230 complete and 0 interrupted iterations
default   [  98% ] 02/10 VUs  4m53.0s/5m00.0s

running (4m54.0s), 02/10 VUs, 230 complete and 0 interrupted iterations
default   [  98% ] 02/10 VUs  4m54.0s/5m00.0s

running (4m55.0s), 02/10 VUs, 230 complete and 0 interrupted iterations
default   [  98% ] 02/10 VUs  4m55.0s/5m00.0s

running (4m56.0s), 02/10 VUs, 230 complete and 0 interrupted iterations
default   [  99% ] 02/10 VUs  4m56.0s/5m00.0s

running (4m57.0s), 01/10 VUs, 232 complete and 0 interrupted iterations
default   [  99% ] 01/10 VUs  4m57.0s/5m00.0s

running (4m58.0s), 01/10 VUs, 232 complete and 0 interrupted iterations
default   [  99% ] 01/10 VUs  4m58.0s/5m00.0s

running (4m59.0s), 01/10 VUs, 232 complete and 0 interrupted iterations
default   [ 100% ] 01/10 VUs  4m59.0s/5m00.0s

running (5m00.0s), 01/10 VUs, 232 complete and 0 interrupted iterations
default   [ 100% ] 01/10 VUs  5m0s

running (5m01.0s), 01/10 VUs, 232 complete and 0 interrupted iterations
default ↓ [ 100% ] 01/10 VUs  5m0s

running (5m02.0s), 01/10 VUs, 232 complete and 0 interrupted iterations
default ↓ [ 100% ] 01/10 VUs  5m0s

running (5m03.0s), 01/10 VUs, 232 complete and 0 interrupted iterations
default ↓ [ 100% ] 01/10 VUs  5m0s

running (5m04.0s), 01/10 VUs, 232 complete and 0 interrupted iterations
default ↓ [ 100% ] 01/10 VUs  5m0s
time="2025-11-10T21:44:41+02:00" level=info source=console
time="2025-11-10T21:44:41+02:00" level=info msg="========================================" source=console
time="2025-11-10T21:44:41+02:00" level=info msg="  BASELINE TEST RESULTS" source=console
time="2025-11-10T21:44:41+02:00" level=info msg="========================================" source=console
time="2025-11-10T21:44:41+02:00" level=info msg="Total Requests: 699" source=console
time="2025-11-10T21:44:41+02:00" level=info msg="Failed Requests: 466 (66.67%)" source=console
time="2025-11-10T21:44:41+02:00" level=info msg="Avg Response Time: 184.55ms" source=console
time="2025-11-10T21:44:41+02:00" level=info msg="P95 Response Time: 306.35ms" source=console
time="2025-11-10T21:44:41+02:00" level=info msg="========================================" source=console
{
  "metrics": {
    "data_received": {
      "type": "counter",
      "contains": "data",
      "values": {
        "count": 459341,
        "rate": 1509.2536369695415
      }
    },
    "http_req_waiting": {
      "values": {
        "avg": 183.81533862660936,
        "min": 144.6194,
        "med": 155.4771,
        "max": 1439.1143,
        "p(90)": 247.2466600000001,
        "p(95)": 306.10664
      },
      "type": "trend",
      "contains": "time"
    },
    "http_req_sending": {
      "type": "trend",
      "contains": "time",
      "values": {
        "max": 2.7163,
        "p(90)": 0.24774000000000435,
        "p(95)": 0.5694900000000002,
        "avg": 0.07456309012875535,
        "min": 0,
        "med": 0
      }
    },
    "iterations": {
      "values": {
        "count": 233,
        "rate": 0.7655665342608284
      },
      "type": "counter",
      "contains": "default"
    },
    "http_req_receiving": {
      "type": "trend",
      "contains": "time",
      "values": {
        "avg": 0.6576500715307584,
        "min": 0,
        "med": 0.3618,
        "max": 25.2379,
        "p(90)": 1.0448000000000002,
        "p(95)": 1.77436
      }
    },
    "frontend_load_time": {
      "contains": "default",
      "values": {
        "avg": 177.62231759656652,
        "min": 145,
        "med": 151,
        "max": 535,
        "p(90)": 260.8,
        "p(95)": 318.4
      },
      "type": "trend"
    },
    "data_sent": {
      "type": "counter",
      "contains": "data",
      "values": {
        "count": 37531,
        "rate": 123.31535449503498
      }
    },
    "http_req_duration": {
      "thresholds": {
        "p(95)<2000": {
          "ok": true
        }
      },
      "type": "trend",
      "contains": "time",
      "values": {
        "p(90)": 247.43082000000015,
        "p(95)": 306.3544300000001,
        "avg": 184.54755178826863,
        "min": 144.8684,
        "med": 156.0133,
        "max": 1439.8622
      }
    },
    "http_req_tls_handshaking": {
      "type": "trend",
      "contains": "time",
      "values": {
        "avg": 5.837926466380544,
        "min": 0,
        "med": 0,
        "max": 560.9084,
        "p(90)": 0,
        "p(95)": 0
      }
    },
    "vus_max": {
      "contains": "default",
      "values": {
        "value": 10,
        "min": 10,
        "max": 10
      },
      "type": "gauge"
    },
    "http_req_blocked": {
      "type": "trend",
      "contains": "time",
      "values": {
        "max": 899.4607,
        "p(90)": 0,
        "p(95)": 0,
        "avg": 8.676761516452075,
        "min": 0,
        "med": 0
      }
    },
    "http_req_connecting": {
      "type": "trend",
      "contains": "time",
      "values": {
        "min": 0,
        "med": 0,
        "max": 338.0275,
        "p(90)": 0,
        "p(95)": 0,
        "avg": 2.7062523605150215
      }
    },
    "http_reqs": {
      "type": "counter",
      "contains": "default",
      "values": {
        "count": 699,
        "rate": 2.296699602782485
      }
    },
    "iteration_duration": {
      "type": "trend",
      "contains": "time",
      "values": {
        "max": 9404.0709,
        "p(90)": 7796.72148,
        "p(95)": 8014.679619999999,
        "avg": 7602.596464377678,
        "min": 7457.0043,
        "med": 7507.5527
      }
    },
    "health_check_time": {
      "type": "trend",
      "contains": "default",
      "values": {
        "min": 148,
        "med": 158,
        "max": 1964,
        "p(90)": 248.0000000000001,
        "p(95)": 530.7999999999994,
        "avg": 210.28755364806867
      }
    },
    "http_req_failed": {
      "type": "rate",
      "contains": "default",
      "values": {
        "rate": 0.6666666666666666,
        "passes": 466,
        "fails": 233
      }
    },
    "checks": {
      "contains": "default",
      "values": {
        "fails": 466,
        "rate": 0.6,
        "passes": 699
      },
      "type": "rate"
    },
    "http_req_duration{expected_response:true}": {
      "type": "trend",
      "contains": "time",
      "values": {
        "avg": 177.4445433476395,
        "min": 144.8684,
        "med": 150.861,
        "max": 534.9101,
        "p(90)": 261.03518,
        "p(95)": 318.70502
      }
    },
    "error_rate": {
      "thresholds": {
        "rate<0.05": {
          "ok": false
        }
      },
      "type": "rate",
      "contains": "default",
      "values": {
        "rate": 0.6666666666666666,
        "passes": 466,
        "fails": 233
      }
    },
    "vus": {
      "type": "gauge",
      "contains": "default",
      "values": {
        "min": 1,
        "max": 10,
        "value": 1
      }
    }
  },
  "root_group": {
    "name": "",
    "path": "",
    "id": "d41d8cd98f00b204e9800998ecf8427e",
    "groups": [],
    "checks": [
        {
          "fails": 233,
          "name": "health endpoint responds",
          "path": "::health endpoint responds",
          "id": "a91384b9ffb009b6d4d6f8dae686981c",
          "passes": 0
        },
        {
          "name": "health response time OK",
          "path": "::health response time OK",
          "id": "574397f09cd586e5a8f93b55ec205a1b",
          "passes": 233,
          "fails": 0
        },
        {
          "id": "165adc9169386ee4d77cb2fdf2e212a3",
          "passes": 233,
          "fails": 0,
          "name": "frontend loads",
          "path": "::frontend loads"
        },
        {
          "name": "frontend load time OK",
          "path": "::frontend load time OK",
          "id": "a1e16edc0e5dfb9548c3a44fd78dfbd6",
          "passes": 233,
          "fails": 0
        },
        {
          "name": "metrics endpoint accessible",
          "path": "::metrics endpoint accessible",
          "id": "e7e6652785cdcc9b7bfe527d26a027de",
          "passes": 0,
          "fails": 233
        }
      ]
  },
  "options": {
    "summaryTrendStats": [
      "avg",
      "min",
      "med",
      "max",
      "p(90)",
      "p(95)"
    ],
    "summaryTimeUnit": "",
    "noColor": false
  },
  "state": {
    "isStdOutTTY": false,
    "isStdErrTTY": false,
    "testRunDurationMs": 304349.7718
  }
}
running (5m04.3s), 00/10 VUs, 233 complete and 0 interrupted iterations
default ✓ [ 100% ] 00/10 VUs  5m0s
time="2025-11-10T21:44:42+02:00" level=error msg="thresholds on metrics 'error_rate' have been crossed"
